### ISSUE TITLE
Strange behavior with snimpy==1.1.0

### ISSUE THREAD

**Issue by eduble** [vincentbernat/snimpy#124]
I tried to upgrade snimpy to 1.1.0 because of a security issue detected on pyasn1==0.6.0, and snimpy==1.1.0 is the only version compatible with later versions of pyasn1, if I understood well.

My code is using snimpy to query LLDP (Link Layer Discovery Protocol) tables and manipulate the state of PoE on switches.

At a high level, the code of my application, and more precisely the code querying the switches became extremely slow and started to raise timeouts.
Looking at it, the platform network was flooded with many SNMP requests (much more than before).

I could reproduced the problem in a clean virtual environment.

With snimpy==1.0.4 first (working as expected):

```
root@ibiza:/tmp# python3 -m venv venv-1.0.4
root@ibiza:/tmp# source venv-1.0.4/bin/activate
(venv-1.0.4) root@ibiza:/tmp# pip install snimpy==1.0.4
[...]
(venv-1.0.4) root@ibiza:/tmp# python3
Python 3.11.2 (main, Nov 30 2024, 21:22:50) [GCC 12.2.0] on linux
Type "help", "copyright", "credits" or "license" for more information.
>>> from snimpy.manager import Manager as M
>>> from snimpy.manager import load
>>> load('LLDP-MIB')
>>> m = M("192.168.222.7", 'private', 2)
>>> dict(m.lldpRemChassisIdSubtype.items())
{(<Unsigned32: 103696>, <Integer: 4>, <Integer: 4>): <Enum: macAddress(4)>, (<Unsigned32: 103701>, <Integer: 2>, <Integer: 2>): <Enum: macAddress(4)>, (<Unsigned32: 113155>, <Integer: 8>, <Integer: 8>): <Enum: macAddress(4)>, (<Unsigned32: 113205>, <Integer: 6>, <Integer: 6>): <Enum: macAddress(4)>}
>>>
```

In another terminal, I had started tcpdump:
```
root@ibiza:~# tcpdump -i walt-net -T snmp -n dst portrange 161-162
```

The last command, `dict(m.lldpRemChassisIdSubtype.items())`, returned very quickly and just caused the following network message to be sent:
```
16:50:56.383023 IP 192.168.222.1.56421 > 192.168.222.7.161:  C="private" GetBulk(31)  N=0 M=40 .1.0.8802.1.1.2.1.4.1.1.4
```

Now, doing the same with snimpy==1.1.0:
```
root@ibiza:/tmp# python3 -m venv venv-1.1.0
root@ibiza:/tmp# source venv-1.1.0/bin/activate
(venv-1.1.0) root@ibiza:/tmp# pip install snimpy==1.1.0
[...]
(venv-1.1.0) root@ibiza:/tmp# python3
Python 3.11.2 (main, Nov 30 2024, 21:22:50) [GCC 12.2.0] on linux
Type "help", "copyright", "credits" or "license" for more information.
>>> from snimpy.manager import Manager as M
>>> from snimpy.manager import load
>>> load('LLDP-MIB')
>>> m = M("192.168.222.7", 'private', 2)
>>> dict(m.lldpRemChassisIdSubtype.items())
Traceback (most recent call last):
  File "<stdin>", line 1, in <module>
  File "/tmp/venv-1.1.0/lib/python3.11/site-packages/snimpy/manager.py", line 454, in iteritems
    for noid, result in self.session.walk(oid):
  File "/tmp/venv-1.1.0/lib/python3.11/site-packages/snimpy/snmp.py", line 383, in <genexpr>
    for noid, result in self.walkmore(oid)
                        ^^^^^^^^^^^^^^^^^^
  File "/tmp/venv-1.1.0/lib/python3.11/site-packages/snimpy/snmp.py", line 361, in walkmore
    results = self._run(self._bulkwalk_async(self.bulk, *oids))
              ^^^^^^^^^^^^^^^^^^^^^^^^^^^^^^^^^^^^^^^^^^^^^^^^^
  File "/tmp/venv-1.1.0/lib/python3.11/site-packages/snimpy/snmp.py", line 97, in _run
    return self._tls.loop.run_until_complete(coro)
           ^^^^^^^^^^^^^^^^^^^^^^^^^^^^^^^^^^^^^^^
  File "/usr/lib/python3.11/asyncio/base_events.py", line 653, in run_until_complete
    return future.result()
           ^^^^^^^^^^^^^^^
  File "/tmp/venv-1.1.0/lib/python3.11/site-packages/snimpy/snmp.py", line 342, in _bulkwalk_async
    self._check_error(errorIndication, errorStatus)
  File "/tmp/venv-1.1.0/lib/python3.11/site-packages/snimpy/snmp.py", line 262, in _check_error
    raise SNMPException(str(errorIndication))
snimpy.snmp.SNMPException: No SNMP response received before timeout
>>>
```

This time the last command hanged for several seconds and raised a timeout.
Moreover the network trace was flooded with SNMP packets this time: 
```
17:04:42.469423 IP 192.168.222.1.40516 > 192.168.222.7.161:  C="private" GetBulk(31)  N=0 M=40 .1.0.8802.1.1.2.1.4.1.1.4
17:04:42.512363 IP 192.168.222.1.40516 > 192.168.222.7.161:  C="private" GetBulk(45)  N=0 M=40 .1.0.8802.1.1.2.1.4.2.1.3.113205.6.6.1.4.192.168.222.12
17:04:42.538523 IP 192.168.222.1.40516 > 192.168.222.7.161:  C="private" GetBulk(36)  N=0 M=40 .1.0.8802.1.1.2.1.5.4623.1.2.1.1.3.6
17:04:42.568187 IP 192.168.222.1.40516 > 192.168.222.7.161:  C="private" GetBulk(40)  N=0 M=40 .1.0.8802.1.1.2.1.5.4623.1.3.1.1.4.113205.6.6
17:04:42.600700 IP 192.168.222.1.40516 > 192.168.222.7.161:  C="private" GetBulk(38)  N=0 M=40 .1.0.8802.1.1.2.1.5.4795.1.2.1.1.4.8.1.64
17:04:42.622021 IP 192.168.222.1.40516 > 192.168.222.7.161:  C="private" GetBulk(37)  N=0 M=40 .1.0.8802.1.1.2.1.5.4795.1.2.9.1.2.6.1
17:04:42.682997 IP 192.168.222.1.40516 > 192.168.222.7.161:  C="private" GetBulk(34)  N=0 M=40 .1.2.840.10006.300.43.1.1.1.1.3.17
17:04:42.712160 IP 192.168.222.1.40516 > 192.168.222.7.161:  C="private" GetBulk(34)  N=0 M=40 .1.2.840.10006.300.43.1.2.1.1.2.4
17:04:42.734919 IP 192.168.222.1.40516 > 192.168.222.7.161:  C="private" GetBulk(34)  N=0 M=40 .1.2.840.10006.300.43.1.2.1.1.6.4
17:04:42.766158 IP 192.168.222.1.40516 > 192.168.222.7.161:  C="private" GetBulk(34)  N=0 M=40 .1.2.840.10006.300.43.1.2.1.1.10.4
[... many more]
```

The strangest is that only the first packets belong to LLDP-MIB (1.0.8802.1.1.2), the next ones are unrelated. It seems that the request triggered a full snmp walk.

Did I do something wrong?
